Symbol,Name,Last Sale,Net Change,% Change,Market Cap
AAPL,Apple Inc. Common Stock,$145.40,-0.75,-0.513%,"2,520,849,236,000"
MSFT,Microsoft Corporation Common Stock,$281.40,2.08,0.745%,"2,119,385,078,651"
AMZN,"Amazon.com, Inc. Common Stock",$3585.20,12.01,0.336%,"1,808,101,458,307"
GOOG,Alphabet Inc. Class C Capital Stock,$2652.01,29.98,1.143%,"1,777,281,080,674"
GOOGL,Alphabet Inc. Class A Common Stock,$2550.98,26.79,1.061%,"1,709,574,432,667"
FB,"Facebook, Inc. Class A Common Stock",$346.23,4.57,1.338%,"981,722,989,476"
TSLA,"Tesla, Inc. Common Stock",$655.29,-5.21,-0.789%,"631,260,809,270"
TSM,Taiwan Semiconductor Manufacturing Company Ltd.,$117.87,1.47,1.263%,"611,273,820,000"
BABA,Alibaba Group Holding Limited American Depositary Shares each representing eight Ordinary share,$211.08,0.49,0.233%,"572,554,500,000"
V,Visa Inc.,$243.66,0.96,0.396%,"519,676,428,636"
NVDA,NVIDIA Corporation Common Stock,$194.10,7.98,4.288%,"483,697,200,000"
JPM,JP Morgan Chase & Co. Common Stock,$152.86,3.15,2.104%,"456,776,252,000"
JNJ,Johnson & Johnson Common Stock,$169.49,1.04,0.617%,"446,334,288,548"
WMT,Walmart Inc. Common Stock,$141.17,-0.70,-0.493%,"395,578,940,515"
UNH,UnitedHealth Group Incorporated Common Stock (DE),$414.64,1.67,0.404%,"391,296,647,037"
MA,Mastercard Incorporated Common Stock,$380.06,5.67,1.514%,"376,657,507,529"
PYPL,"PayPal Holdings, Inc. Common Stock",$301.77,3.70,1.241%,"354,497,684,856"
HD,"Home Depot, Inc. (The) Common Stock",$326.36,1.01,0.31%,"347,005,022,520"
PG,Procter & Gamble Company (The) Common Stock,$139.20,-0.49,-0.351%,"340,794,003,811"
BAC,Bank of America Corporation Common Stock,$38.46,0.77,2.043%,"331,804,133,150"
DIS,Walt Disney Company (The) Common Stock,$176.89,0.14,0.079%,"321,397,111,740"
ASML,ASML Holding N.V. New York Registry Shares,$721.00,36.95,5.402%,"300,306,618,514"
ADBE,Adobe Inc. Common Stock,$612.26,3.54,0.582%,"291,680,664,000"
CMCSA,Comcast Corporation Class A Common Stock,$57.81,0.73,1.279%,"265,595,858,363"
NKE,"Nike, Inc. Common Stock",$161.08,1.34,0.839%,"254,501,096,280"
TM,Toyota Motor Corporation Common Stock,$179.68,1.56,0.876%,"250,990,399,020"
ORCL,Oracle Corporation Common Stock,$89.69,1.03,1.162%,"250,414,480,000"
XOM,Exxon Mobil Corporation Common Stock,$57.76,1.80,3.217%,"244,529,207,846"
KO,Coca-Cola Company (The) Common Stock,$56.55,0.72,1.29%,"243,794,340,652"
VZ,Verizon Communications Inc. Common Stock,$55.95,0.37,0.666%,"231,636,784,066"
PFE,"Pfizer, Inc. Common Stock",$41.02,-0.03,-0.073%,"229,617,402,424"
NFLX,"Netflix, Inc. Common Stock",$513.63,-17.42,-3.28%,"227,744,947,292"
LLY,Eli Lilly and Company Common Stock,$237.29,2.27,0.966%,"227,567,148,081"
CSCO,"Cisco Systems, Inc. Common Stock (DE)",$53.88,0.30,0.56%,"227,469,805,272"
INTC,Intel Corporation Common Stock,$56.23,0.99,1.792%,"227,056,740,000"
CRM,Salesforce.com Inc Common Stock,$242.11,2.00,0.833%,"224,193,860,000"
PEP,"PepsiCo, Inc. Common Stock",$155.24,-0.58,-0.372%,"214,559,525,769"
ABT,Abbott Laboratories Common Stock,$118.98,0.25,0.211%,"211,406,061,209"
ABBV,AbbVie Inc. Common Stock,$116.99,0.94,0.81%,"206,630,351,089"
NVO,Novo Nordisk A/S Common Stock,$88.81,1.30,1.486%,"203,748,395,428"
NVS,Novartis AG Common Stock,$90.48,0.24,0.266%,"203,135,635,438"
TMO,Thermo Fisher Scientific Inc Common Stock,$514.26,-8.32,-1.592%,"202,118,520,654"
DHR,Danaher Corporation Common Stock,$279.80,-3.80,-1.34%,"199,575,426,707"
T,AT&T Inc.,$27.90,-0.01,-0.036%,"199,206,000,000"
ACN,Accenture plc Class A Ordinary Shares (Ireland),$313.77,1.71,0.548%,"198,973,051,650"
AVGO,Broadcom Inc. Common Stock,$479.02,10.43,2.226%,"196,523,013,451"
SHOP,Shopify Inc. Class A Subordinate Voting Shares,$1569.36,44.58,2.924%,"195,201,987,365"
MRK,"Merck & Company, Inc. Common Stock (new)",$76.39,0.22,0.289%,"193,423,938,426"
CVX,Chevron Corporation Common Stock,$99.82,3.29,3.408%,"192,458,867,248"
BHP,BHP Group Limited American Depositary Shares (Each representing two Ordinary Shares),$75.74,1.91,2.587%,"191,508,590,000"
WFC,Wells Fargo & Company Common Stock,$45.80,0.96,2.141%,"188,146,320,949"
UPS,"United Parcel Service, Inc. Common Stock",$212.45,-0.01,-0.005%,"184,944,652,570"
COST,Costco Wholesale Corporation Common Stock,$415.01,-1.23,-0.296%,"183,463,093,456"
TMUS,"T-Mobile US, Inc. Common Stock",$144.57,0.17,0.118%,"180,258,229,399"
TXN,Texas Instruments Incorporated Common Stock,$194.24,6.47,3.446%,"179,385,209,108"
MCD,McDonald's Corporation Common Stock,$235.93,1.66,0.709%,"176,044,898,824"
MS,Morgan Stanley Common Stock,$95.68,3.36,3.64%,"175,477,120,000"
MDT,Medtronic plc. Ordinary Shares,$127.05,1.54,1.227%,"170,743,026,069"
SAP,SAP  SE ADS,$138.86,-5.24,-3.636%,"163,796,387,152"
HON,Honeywell International Inc. Common Stock,$231.85,2.19,0.954%,"161,032,716,556"
QCOM,QUALCOMM Incorporated Common Stock,$142.17,2.62,1.877%,"160,367,760,000"
BBL,BHP Group PlcSponsored ADR,$62.32,1.86,3.076%,"157,576,120,000"
SE,"Sea Limited American Depositary Shares, each representing one Class A Ordinary Share",$293.92,14.28,5.107%,"154,141,494,908"
UL,Unilever PLC Common Stock,$58.71,-0.11,-0.187%,"153,166,076,547"
LIN,Linde plc Ordinary Share,$294.20,3.83,1.319%,"152,992,739,211"
AZN,AstraZeneca PLC American Depositary Shares,$57.77,0.23,0.40%,"151,679,510,500"
PM,Philip Morris International Inc Common Stock,$96.54,1.61,1.696%,"150,461,161,690"
BMY,Bristol-Myers Squibb Company Common Stock,$67.16,0.44,0.659%,"149,957,786,586"
NEE,"NextEra Energy, Inc. Common Stock",$75.88,-1.29,-1.672%,"148,834,451,153"
CHTR,"Charter Communications, Inc. Class A Common Stock New",$718.42,-0.34,-0.047%,"147,203,666,740"
UNP,Union Pacific Corporation Common Stock,$217.19,1.71,0.794%,"144,279,864,536"
RY,Royal Bank Of Canada Common Stock,$100.51,1.10,1.107%,"143,236,438,460"
AMGN,Amgen Inc. Common Stock,$244.85,-2.04,-0.826%,"140,679,543,472"
INTU,Intuit Inc. Common Stock,$514.45,5.89,1.158%,"140,578,229,394"
SBUX,Starbucks Corporation Common Stock,$119.27,1.85,1.576%,"140,535,841,000"
AXP,American Express Company Common Stock,$172.51,3.64,2.156%,"138,577,776,206"
LOW,"Lowe's Companies, Inc. Common Stock",$195.13,1.02,0.525%,"137,935,472,433"
C,"Citigroup, Inc. Common Stock",$67.89,1.60,2.414%,"137,599,452,000"
BUD,Anheuser-Busch Inbev SA Sponsored ADR (Belgium),$68.40,1.47,2.196%,"135,411,940,674"
BLK,"BlackRock, Inc. Common Stock",$882.68,3.84,0.437%,"134,431,090,661"
RIO,Rio Tinto Plc Common Stock,$82.94,1.49,1.829%,"134,279,160,318"
SCHW,Charles Schwab Corporation (The) Common Stock,$69.56,1.62,2.384%,"131,214,250,993"
RTX,Raytheon Technologies Corporation Common Stock,$86.58,1.78,2.099%,"131,176,480,945"
PDD,Pinduoduo Inc. American Depositary Shares,$104.52,2.27,2.22%,"130,993,745,481"
BA,Boeing Company (The) Common Stock,$222.54,5.39,2.482%,"130,143,632,533"
HDB,HDFC Bank Limited Common Stock,$70.27,0.93,1.341%,"129,454,183,649"
SNY,Sanofi ADR,$51.50,0.10,0.195%,"129,010,896,425"
MRNA,"Moderna, Inc. Common Stock",$321.11,13.78,4.484%,"128,934,588,326"
AMT,American Tower Corporation (REIT) Common Stock,$280.26,-2.74,-0.968%,"127,433,124,222"
GS,"Goldman Sachs Group, Inc. (The) Common Stock",$373.50,8.74,2.396%,"126,901,179,459"
TGT,Target Corporation Common Stock,$256.05,1.34,0.526%,"126,674,037,696"
IBM,International Business Machines Corporation Common Stock,$141.30,1.33,0.95%,"126,254,775,596"
AMAT,"Applied Materials, Inc. Common Stock",$138.00,6.03,4.569%,"126,129,344,328"
SONY,Sony Group Corporation American Depositary Shares ,$100.46,1.38,1.393%,"124,489,868,853"
TD,Toronto Dominion Bank (The) Common Stock,$65.92,0.99,1.525%,"119,888,704,000"
JD,"JD.com, Inc. American Depositary Shares",$75.30,1.43,1.936%,"117,391,590,003"
SQ,"Square, Inc. Class A Common Stock",$257.25,10.78,4.374%,"117,143,585,470"
EL,"Estee Lauder Companies, Inc. (The) Common Stock",$323.08,-0.37,-0.114%,"117,120,336,252"
MMM,3M Company Common Stock,$200.77,-0.05,-0.025%,"116,381,350,152"
CAT,"Caterpillar, Inc. Common Stock",$210.73,2.77,1.332%,"115,435,186,541"
GE,General Electric Company Common Stock,$13.08,0.38,2.992%,"114,824,624,280"
HSBC,"HSBC Holdings, plc. Common Stock",$27.66,0.62,2.293%,"112,997,285,716"
VALE,VALE S.A.  American Depositary Shares Each Representing one common share,$22.05,0.42,1.942%,"112,895,034,408"
NOW,"ServiceNow, Inc. Common Stock",$567.13,1.88,0.333%,"111,978,676,867"
ISRG,"Intuitive Surgical, Inc. Common Stock",$944.94,-10.11,-1.059%,"111,893,074,387"
TTE,TotalEnergies SE,$42.35,1.09,2.642%,"111,814,795,184"
DEO,Diageo plc Common Stock,$189.84,1.50,0.796%,"110,895,559,769"
DE,Deere & Company Common Stock,$353.00,4.97,1.428%,"110,115,558,476"
CVS,CVS Health Corporation Common Stock,$83.06,1.26,1.54%,"109,354,127,365"
AMD,"Advanced Micro Devices, Inc. Common Stock",$89.41,2.30,2.64%,"108,635,025,464"
LMT,Lockheed Martin Corporation Common Stock,$380.89,0.91,0.239%,"105,862,275,547"
ZM,"Zoom Video Communications, Inc. Class A Common Stock",$352.97,-2.84,-0.798%,"105,122,278,638"
SPGI,S&P Global Inc. Common Stock,$417.06,0.68,0.163%,"100,469,754,000"
SNAP,Snap Inc. Class A Common Stock,$63.39,1.06,1.701%,"99,582,801,508"
GSK,GlaxoSmithKline PLC Common Stock,$39.32,0.23,0.588%,"98,922,735,100"
SYK,Stryker Corporation Common Stock,$258.68,3.50,1.372%,"97,457,137,977"
ZTS,Zoetis Inc. Class A Common Stock,$198.04,-2.07,-1.034%,"94,022,797,466"
ANTM,"Anthem, Inc. Common Stock",$383.59,-6.35,-1.628%,"93,918,426,468"
PLD,"Prologis, Inc. Common Stock",$126.90,-1.09,-0.852%,"93,877,193,700"
LRCX,Lam Research Corporation Common Stock,$637.25,30.16,4.968%,"90,884,178,239"
INFY,Infosys Limited American Depositary Shares,$21.31,0.37,1.767%,"90,761,117,610"
FIS,"Fidelity National Information Services, Inc. Common Stock",$145.47,0.64,0.442%,"90,209,664,922"
BKNG,Booking Holdings Inc. Common Stock,$2194.03,63.60,2.985%,"90,071,103,306"
MDLZ,"Mondelez International, Inc. Class A Common Stock",$64.02,-0.39,-0.605%,"89,929,612,560"
UBER,"Uber Technologies, Inc. Common Stock",$47.52,1.20,2.591%,"89,241,616,776"
MO,"Altria Group, Inc.",$47.33,0.12,0.254%,"87,590,695,309"
ADP,"Automatic Data Processing, Inc. Common Stock",$204.47,1.33,0.655%,"87,005,730,890"
BTI,"British American Tobacco  Industries, p.l.c. Common Stock ADR",$37.88,0.54,1.446%,"86,920,494,814"
CCI,Crown Castle International Corp. (REIT) Common Stock,$201.10,-2.18,-1.072%,"86,913,337,811"
MU,"Micron Technology, Inc. Common Stock",$77.19,1.80,2.388%,"86,896,917,296"
GILD,"Gilead Sciences, Inc. Common Stock",$68.41,-0.75,-1.084%,"85,798,328,336"
USB,U.S. Bancorp Common Stock,$57.20,1.11,1.979%,"84,827,600,000"
ABNB,"Airbnb, Inc. Class A Common Stock",$139.25,3.16,2.322%,"83,048,561,725"
GM,General Motors Company Common Stock,$57.05,0.90,1.603%,"82,760,773,134"
HCA,"HCA Healthcare, Inc. Common Stock",$249.25,0.35,0.141%,"82,415,883,375"
TJX,"TJX Companies, Inc. (The) Common Stock",$67.48,0.98,1.474%,"81,413,755,311"
BP,BP p.l.c. Common Stock,$23.91,0.80,3.462%,"80,673,599,268"
BAM,Brookfield Asset Management Inc. Common Stock,$50.97,1.79,3.64%,"80,410,438,468"
CI,Cigna Corporation Common Stock,$233.57,1.55,0.668%,"80,021,082,000"
FDX,FedEx Corporation Common Stock,$298.35,0.33,0.111%,"79,763,345,017"
DUK,Duke Energy Corporation (Holding Company) Common Stock,$103.16,-0.58,-0.559%,"79,352,627,501"
PNC,"PNC Financial Services Group, Inc. (The) Common Stock",$184.87,3.27,1.801%,"78,543,562,980"
PTR,PetroChina Company Limited Common Stock,$42.86,0.74,1.757%,"78,442,791,085"
ENB,Enbridge Inc Common Stock,$38.60,0.66,1.74%,"78,187,248,461"
MELI,"MercadoLibre, Inc. Common Stock",$1550.17,8.02,0.52%,"77,279,569,344"
COP,ConocoPhillips Common Stock,$57.02,2.55,4.681%,"76,943,840,247"
SNOW,Snowflake Inc. Class A Common Stock,$259.30,3.03,1.182%,"76,778,730,000"
NIO,"NIO Inc. American depositary shares, each  representing one Class A ordinary share",$46.77,2.60,5.886%,"76,633,491,958"
CB,Chubb Limited  Common Stock,$169.42,1.75,1.044%,"76,186,577,217"
CME,CME Group Inc. Class A Common Stock,$212.00,3.42,1.64%,"76,128,602,160"
NTES,"NetEase, Inc. American Depositary Shares",$113.04,-0.18,-0.159%,"75,847,655,841"
BNS,Bank Nova Scotia Halifax Pfd 3 Ordinary Shares,$62.11,0.86,1.404%,"75,392,596,160"
SHW,Sherwin-Williams Company (The) Common Stock,$281.83,0.59,0.21%,"74,952,576,050"
BX,The Blackstone Group Inc. Common Stock,$105.79,1.95,1.878%,"74,553,058,963"
TFC,Truist Financial Corporation Common Stock,$55.28,1.21,2.238%,"73,786,085,600"
CNI,Canadian National Railway Company Common Stock,$104.22,1.92,1.877%,"73,783,632,680"
COF,Capital One Financial Corporation Common Stock,$163.21,5.23,3.311%,"73,687,575,671"
DELL,Dell Technologies Inc. Class C Common Stock ,$96.21,0.84,0.881%,"73,474,630,197"
EQIX,"Equinix, Inc. Common Stock REIT",$819.76,-12.89,-1.548%,"73,434,023,743"
FISV,"Fiserv, Inc. Common Stock",$110.04,1.20,1.103%,"72,821,102,795"
ITW,Illinois Tool Works Inc. Common Stock,$229.35,0.26,0.113%,"72,447,704,584"
MMC,"Marsh & McLennan Companies, Inc. Common Stock",$142.39,0.69,0.487%,"72,409,860,943"
ABB,ABB Ltd Common Stock,$35.84,0.72,2.05%,"71,894,823,132"
CSX,CSX Corporation Common Stock,$31.57,0.39,1.251%,"71,733,374,457"
BDX,"Becton, Dickinson and Company Common Stock",$246.35,-0.65,-0.263%,"71,643,138,460"
MCO,Moody's Corporation Common Stock,$379.00,1.69,0.448%,"70,948,800,000"
ATVI,"Activision Blizzard, Inc. Common Stock",$91.17,-0.34,-0.372%,"70,840,617,918"
ILMN,"Illumina, Inc. Common Stock",$480.85,-6.40,-1.313%,"70,204,100,000"
PBR,Petroleo Brasileiro S.A.- Petrobras Common Stock,$10.70,0.24,2.294%,"69,786,476,741"
CL,Colgate-Palmolive Company Common Stock,$82.18,-0.51,-0.617%,"69,521,714,340"
MUFG,"Mitsubishi UFJ Financial Group, Inc. Common Stock",$5.35,0.09,1.711%,"68,719,214,368"
CPNG,"Coupang, Inc. Class A Common Stock",$39.65,0.82,2.112%,"68,696,012,287"
TWLO,Twilio Inc. Class A Common Stock,$393.90,3.68,0.943%,"68,024,866,560"
ICE,Intercontinental Exchange Inc. Common Stock,$120.23,1.09,0.915%,"67,661,326,724"
WBK,Westpac Banking Corporation Common Stock,$18.42,0.21,1.153%,"67,516,488,663"
TEAM,Atlassian Corporation Plc Class A Ordinary Shares,$268.85,1.23,0.46%,"67,229,106,865"
SO,Southern Company (The) Common Stock,$62.82,-0.13,-0.207%,"66,503,160,786"
ADSK,"Autodesk, Inc. Common Stock",$301.78,5.66,1.911%,"66,395,618,201"
EW,Edwards Lifesciences Corporation Common Stock,$106.05,-0.53,-0.497%,"65,924,580,201"
VMW,"Vmware, Inc. Common stock, Class A",$156.32,1.01,0.65%,"65,487,291,263"
NSC,Norfolk Southern Corporation Common Stock,$260.65,3.82,1.487%,"65,225,318,996"
BMO,Bank Of Montreal Common Stock,$98.81,1.68,1.73%,"63,962,561,099"
EQNR,Equinor ASA,$19.68,0.71,3.743%,"63,889,475,716"
APD,"Air Products and Chemicals, Inc. Common Stock",$286.72,0.77,0.269%,"63,455,224,054"
SAN,"Banco Santander, S.A. Sponsored ADR (Spain)",$3.64,0.14,4.00%,"63,017,597,261"
BIDU,"Baidu, Inc. ADS",$180.51,2.62,1.473%,"62,727,760,754"
BNTX,BioNTech SE American Depositary Share,$259.61,14.44,5.89%,"62,701,283,685"
REGN,"Regeneron Pharmaceuticals, Inc. Common Stock",$583.72,-3.52,-0.599%,"62,191,749,855"
ETN,"Eaton Corporation, PLC Ordinary Shares",$155.63,1.54,0.999%,"62,018,555,000"
BSX,Boston Scientific Corporation Common Stock,$43.58,0.79,1.846%,"61,923,295,061"
ECL,Ecolab Inc. Common Stock,$214.47,0.27,0.126%,"61,324,993,320"
WM,"Waste Management, Inc. Common Stock",$144.85,-0.32,-0.22%,"61,145,133,611"
ADI,"Analog Devices, Inc. Common Stock",$164.84,3.93,2.442%,"60,797,429,163"
IBN,ICICI Bank Limited Common Stock,$17.52,0.12,0.69%,"60,669,038,601"
D,"Dominion Energy, Inc. Common Stock",$74.72,-0.95,-1.255%,"60,263,498,461"
HUM,Humana Inc. Common Stock,$463.48,2.98,0.647%,"59,795,606,626"
DOCU,"DocuSign, Inc. Common Stock",$302.81,1.54,0.511%,"58,998,024,201"
EMR,Emerson Electric Company Common Stock,$98.27,1.14,1.174%,"58,932,519,000"
WDAY,"Workday, Inc. Class A Common Stock",$237.36,6.53,2.829%,"58,627,920,000"
DASH,"DoorDash, Inc. Class A Common Stock",$179.02,1.46,0.822%,"58,331,492,623"
BSBR,"Banco Santander Brasil SA American Depositary Shares, each representing one unit",$7.80,0.09,1.167%,"58,241,734,200"
NOC,Northrop Grumman Corporation Common Stock,$361.46,1.49,0.414%,"58,181,038,244"
STLA,Stellantis N.V. Common Shares,$18.49,0.54,3.008%,"57,897,328,741"
CRWD,"CrowdStrike Holdings, Inc. Class A Common Stock",$253.55,1.31,0.519%,"57,254,282,194"
IDXX,"IDEXX Laboratories, Inc. Common Stock",$670.51,1.12,0.167%,"57,181,531,314"
SNP,China Petroleum & Chemical Corporation Common Stock,$46.84,0.67,1.451%,"56,709,754,577"
F,Ford Motor Company Common Stock,$14.19,0.28,2.013%,"56,641,434,873"
GPN,Global Payments Inc. Common Stock,$191.81,3.06,1.621%,"56,625,327,637"
ROKU,"Roku, Inc. Class A Common Stock",$422.13,4.93,1.182%,"55,889,413,842"
TWTR,"Twitter, Inc. Common Stock",$69.54,1.60,2.355%,"55,501,725,920"
DIDI,DiDi Global Inc. American Depositary Shares (each four representing one Class A Ordinary Share),$11.50,0.29,2.587%,"55,467,276,974"
ITUB,Itau Unibanco Banco Holding SA American Depositary Shares (Each repstg 500 Preferred shares),$5.64,0.09,1.622%,"55,295,323,363"
PGR,Progressive Corporation (The) Common Stock,$94.01,-0.41,-0.434%,"55,014,652,000"
NXPI,NXP Semiconductors N.V. Common Stock,$198.62,5.31,2.747%,"54,768,834,779"
HMC,"Honda Motor Company, Ltd. Common Stock",$31.67,0.15,0.476%,"54,683,172,338"
RELX,RELX PLC PLC American Depositary Shares (Each representing One Ordinary Share),$28.09,0.09,0.321%,"54,310,360,920"
GD,General Dynamics Corporation Common Stock,$191.63,1.62,0.853%,"54,154,213,731"
PSA,Public Storage Common Stock,$308.29,-3.90,-1.249%,"53,944,010,781"
UBS,UBS Group AG Registered Ordinary Shares,$15.80,0.53,3.471%,"53,190,941,313"
TAK,Takeda Pharmaceutical Company Limited American Depositary Shares (each representing 1/2 of a share of Common Stock),$16.85,-0.16,-0.941%,"53,124,272,500"
DG,Dollar General Corporation Common Stock,$224.22,-2.19,-0.967%,"52,961,994,968"
ROP,"Roper Technologies, Inc. Common Stock",$493.79,2.23,0.454%,"51,965,979,636"
LULU,lululemon athletica inc. Common Stock,$383.62,0.32,0.083%,"51,926,144,524"
AON,Aon plc Class A Ordinary Shares (Ireland),$230.06,1.27,0.555%,"51,912,406,335"
AMX,"America Movil, S.A.B. de C.V. American Depository Receipt Series L",$15.65,0.06,0.385%,"51,723,250,000"
MET,"MetLife, Inc. Common Stock",$58.99,1.29,2.236%,"51,640,728,313"
EPD,Enterprise Products Partners L.P. Common Stock,$23.63,-0.13,-0.547%,"51,635,770,389"
AMOV,"America Movil, S.A.B. de C.V. Class A American Depositary Shares",$15.62,0.09,0.58%,"51,624,100,000"
TRI,Thomson Reuters Corp Ordinary Shares,$103.65,1.03,1.004%,"51,374,596,595"
ABEV,Ambev S.A. American Depositary Shares (Each representing 1 Common Share),$3.26,0.06,1.875%,"51,309,855,329"
CM,Canadian Imperial Bank of Commerce Common Stock,$113.44,2.23,2.005%,"50,945,124,213"
RACE,Ferrari N.V. Common Shares,$205.61,1.47,0.72%,"50,938,941,563"
VRTX,Vertex Pharmaceuticals Incorporated Common Stock,$196.27,-0.28,-0.142%,"50,807,565,247"
FCX,"Freeport-McMoRan, Inc. Common Stock",$34.65,1.70,5.159%,"50,780,504,417"
JCI,Johnson Controls International plc Ordinary Share,$70.56,0.82,1.176%,"50,571,416,821"
KDP,Keurig Dr Pepper Inc. Common Stock,$35.50,-0.39,-1.087%,"50,318,509,933"
LFC,China Life Insurance Company Limited American Depositary Shares,$8.81,0.04,0.456%,"49,802,410,210"
BBD,Banco Bradesco Sa American Depositary Shares,$4.64,0.04,0.87%,"49,606,182,135"
VEEV,Veeva Systems Inc. Class A Common Stock,$323.87,-0.09,-0.028%,"49,525,963,327"
CMG,"Chipotle Mexican Grill, Inc. Common Stock",$1755.99,181.64,11.537%,"49,431,959,619"
PUK,Prudential Public Limited Company Common Stock,$37.78,1.68,4.654%,"49,408,901,991"
MNST,Monster Beverage Corporation,$93.35,-0.36,-0.384%,"49,341,282,957"
SCCO,Southern Copper Corporation Common Stock,$63.55,1.51,2.434%,"49,128,806,245"
ALGN,"Align Technology, Inc. Common Stock",$619.65,3.94,0.64%,"49,036,978,699"
ING,"ING Group, N.V. Common Stock",$12.52,0.42,3.471%,"48,869,673,433"
BIIB,Biogen Inc. Common Stock,$322.96,0.47,0.146%,"48,623,162,060"
KLAC,KLA Corporation Common Stock,$316.88,14.11,4.66%,"48,571,931,397"
NEM,Newmont Corporation,$60.36,-0.08,-0.132%,"48,358,134,819"
CP,Canadian Pacific Railway Limited Common Stock,$72.30,0.43,0.598%,"48,196,374,758"
COIN,"Coinbase Global, Inc. Class A Common Stock",$230.87,5.91,2.627%,"48,173,827,569"
KHC,The Kraft Heinz Company Common Stock,$39.37,-0.03,-0.076%,"48,155,310,776"
MRVL,"Marvell Technology, Inc. Common Stock",$58.33,1.77,3.129%,"47,801,435,000"
EBAY,eBay Inc. Common Stock,$69.86,0.29,0.417%,"47,592,937,891"
TT,Trane Technologies plc,$198.67,2.19,1.115%,"47,511,435,216"
TRP,TC Energy Corporation Common Stock,$48.47,0.85,1.785%,"47,452,130,000"
SPOT,Spotify Technology S.A. Ordinary Shares,$247.91,1.41,0.572%,"47,345,465,804"
TROW,"T. Rowe Price Group, Inc. Common Stock",$207.36,3.08,1.508%,"47,040,772,032"
SMFG,Sumitomo Mitsui Financial Group Inc Unsponsored American Depositary Shares (Japan),$6.82,0.06,0.888%,"46,731,586,582"
IQV,"IQVIA Holdings, Inc. Common Stock",$243.03,-4.04,-1.635%,"46,579,415,117"
MSCI,MSCI Inc Common Stock,$564.86,1.29,0.229%,"46,557,256,384"
LHX,"L3Harris Technologies, Inc. Common Stock",$227.10,1.59,0.705%,"46,551,825,976"
PINS,"Pinterest, Inc. Class A Common Stock",$72.23,0.80,1.12%,"46,000,467,574"
TEL,TE Connectivity Ltd. New Switzerland Registered Shares,$139.30,3.78,2.789%,"46,000,290,402"
INFO,IHS Markit Ltd. Common Shares,$115.15,0.28,0.244%,"45,900,205,424"
MAR,Marriott International Class A Common Stock,$140.36,5.33,3.947%,"45,706,625,474"
KMB,Kimberly-Clark Corporation Common Stock,$135.44,-2.29,-1.663%,"45,701,734,279"
RBLX,Roblox Corporation Class A Common Stock,$79.91,0.05,0.063%,"45,535,232,208"
WIT,Wipro Limited Common Stock,$8.28,0.07,0.853%,"45,207,464,221"
A,"Agilent Technologies, Inc. Common Stock",$148.95,-0.35,-0.234%,"45,197,868,364"
NGG,"National Grid Transco, PLC National Grid PLC (NEW) American Depositary Shares",$63.36,0.04,0.063%,"45,054,971,533"
BEKE,KE Holdings Inc American Depositary Shares (each representing three Class A Ordinary Shares),$37.75,-0.25,-0.658%,"44,956,386,099"
EXC,Exelon Corporation Common Stock,$45.84,-0.22,-0.478%,"44,793,712,772"
DOW,Dow Inc. Common Stock ,$59.73,1.11,1.894%,"44,617,679,371"
VOD,Vodafone Group Plc American Depositary Shares,$16.01,0.32,2.04%,"44,549,388,200"
BCE,"BCE, Inc. Common Stock",$49.10,0.26,0.532%,"44,416,593,456"
BILI,Bilibili Inc. American Depositary Shares,$115.58,3.66,3.27%,"44,257,366,440"
MTCH,"Match Group, Inc. Common Stock",$159.70,5.93,3.856%,"44,155,176,400"
LYG,Lloyds Banking Group Plc American Depositary Shares,$2.47,0.10,4.219%,"43,823,993,789"
CARR,Carrier Global Corporation Common Stock ,$50.45,0.55,1.102%,"43,785,486,338"
DLR,"Digital Realty Trust, Inc. Common Stock",$154.68,-2.32,-1.478%,"43,555,984,199"
ROST,"Ross Stores, Inc. Common Stock",$121.65,3.06,2.58%,"43,443,729,141"
BBDO,Banco Bradesco Sa American Depositary Shares (each representing one Common Share),$4.06,0.02,0.495%,"43,405,409,368"
STZ,"Constellation Brands, Inc. Common Stock",$225.85,0.68,0.302%,"43,382,698,760"
EOG,"EOG Resources, Inc. Common Stock",$74.19,2.69,3.762%,"43,297,664,001"
DXCM,"DexCom, Inc. Common Stock",$446.98,-0.72,-0.161%,"43,225,591,114"
FTNT,"Fortinet, Inc. Common Stock",$264.65,0.81,0.307%,"43,222,016,602"
BK,The Bank of New York Mellon Corporation Common Stock,$50.06,0.62,1.254%,"43,210,490,440"
CNC,Centene Corporation Common Stock,$72.91,1.24,1.73%,"42,487,192,591"
SNPS,"Synopsys, Inc. Common Stock",$278.22,0.33,0.119%,"42,449,389,791"
PLTR,Palantir Technologies Inc. Class A Common Stock,$22.52,0.34,1.533%,"42,339,336,495"
AEP,"American Electric Power Company, Inc. Common Stock",$84.72,-1.02,-1.19%,"42,338,853,888"
PHG,Koninklijke Philips N.V. NY Registry Shares,$46.43,0.41,0.891%,"42,319,749,938"
APTV,Aptiv PLC Ordinary Shares,$156.05,2.90,1.894%,"42,205,711,981"
ORLY,"O'Reilly Automotive, Inc. Common Stock",$604.39,-2.99,-0.492%,"42,163,247,270"
SPG,"Simon Property Group, Inc. Common Stock",$127.93,2.30,1.831%,"42,030,044,419"
APH,Amphenol Corporation Common Stock,$70.15,1.54,2.245%,"41,922,742,758"
AIG,"American International Group, Inc. New Common Stock",$48.29,1.06,2.244%,"41,603,077,695"
BBVA,Banco Bilbao Vizcaya Argentaria S.A. Common Stock,$6.17,0.28,4.754%,"41,091,500,199"
E,ENI S.p.A. Common Stock,$22.92,0.51,2.276%,"40,941,418,989"
CTAS,Cintas Corporation Common Stock,$392.16,2.96,0.761%,"40,808,715,095"
KMI,"Kinder Morgan, Inc. Common Stock",$17.85,0.38,2.175%,"40,422,799,107"
WBA,"Walgreens Boots Alliance, Inc. Common Stock",$46.67,0.61,1.324%,"40,368,957,571"
BAX,Baxter International Inc. Common Stock,$80.27,-0.27,-0.335%,"40,363,929,478"
ALXN,"Alexion Pharmaceuticals, Inc. Common Stock",$182.50,UNCH,--,"40,336,009,475"
EA,Electronic Arts Inc. Common Stock,$140.72,-0.35,-0.248%,"40,208,437,258"
PAYX,"Paychex, Inc. Common Stock",$111.39,0.93,0.842%,"40,081,484,307"
PRU,"Prudential Financial, Inc. Common Stock",$101.21,2.15,2.17%,"39,876,740,000"
DD,"DuPont de Nemours, Inc. Common Stock",$74.87,1.16,1.574%,"39,841,496,696"
SLB,Schlumberger N.V. Common Stock,$28.43,1.19,4.369%,"39,754,591,923"
BCS,Barclays PLC Common Stock,$9.30,0.36,4.027%,"39,520,053,488"
SRE,DBA Sempra Common Stock,$130.30,-1.62,-1.228%,"39,449,719,862"
PH,Parker-Hannifin Corporation Common Stock,$305.18,5.65,1.886%,"39,385,293,295"
ERIC,Ericsson American Depositary Shares,$11.76,0.16,1.379%,"39,207,840,000"
CDNS,"Cadence Design Systems, Inc. Common Stock",$140.76,0.97,0.694%,"39,168,581,400"
CNQ,Canadian Natural Resources Limited Common Stock,$32.73,1.27,4.037%,"38,779,715,010"
ALL,Allstate Corporation (The) Common Stock,$128.79,0.96,0.751%,"38,551,829,112"
